{"artifact_type":"transparency_checkpoint_rebinding","canonicalization":{"json_mode":"canonical_json","key_ordering":"recursive_lexicographic","numeric_normalization":"verbatim_json_number_encoding","whitespace":"minimal"},"checkpoint":{"checkpoint_hash":"3d5460ce02f4f5397a0a15d49d403d59a55e5d36b7fbb6f4342d6ba678831ed1","checkpoint_path":"manifests/transparency/checkpoint.json","transparency_log_path":"manifests/transparency/transparency-log.json","transparency_log_root":"e2f2d0522e4e7f3fad81640368dd37b3844166fd060c9e82a6d0250ed2a3d2d7"},"compatibility":{"compatible_from_phase":"7.12","compatible_through_phase":"7.27","preserves_append_only_transparency":true,"preserves_canonical_json_hashing":true,"preserves_checkpoint_trust_chain":true,"preserves_deterministic_rebuilds":true,"preserves_recursive_key_sorted_canonicalization":true},"generated_at":"2026-03-07T00:00:00Z","hashes":{"rebinding_hash":"a926b66422906b03d19da972df23a38d20b7d76b069d00cd85eda4f6918cd32f"},"prior_finalization":{"artifact_hash":"unchanged_architecture_reference","path":"manifests/transparency/checkpoint-finalization.json"},"prior_witnesses":{"artifact_hash":"unchanged_architecture_reference","path":"manifests/transparency/checkpoint-witnesses.json"},"rebinding_scope":"post_lifecycle_replay_inclusion","rebound_finalization":{"artifact_hash":"80d884d5356263d522baa47d2c4bde82e47602733c0b2768e848142fc5585d16","finalization_status":"finalized","path":"manifests/transparency/checkpoint-finalization.json"},"rebound_witnesses":{"artifact_hash":"20f8631ada512a3fb5d39bf0160b2e1aba5237a8ceb55983e0a00588055c8fca","path":"manifests/transparency/checkpoint-witnesses.json","witness_count":1},"schema_version":"grant-audit-transparency-checkpoint-rebinding-v1"}
